<dbc:dbList xmlns:dbc="http://www.likyateknoloji.com/XML_dbconnection_types"
	xmlns:com="http://www.likyateknoloji.com/XML_common_types" xmlns:xsi="http://www.w3.org/2001/XMLSchema-instance"
	xsi:schemaLocation="http://www.likyateknoloji.com/XML_dbconnection_types  ../xsds/tlosSWDBConnections_v_1_0.xsd">
	<dbc:dbProperties ID="4">
		<dbc:connectionName>Centos</dbc:connectionName>
		<dbc:dbUrl>jdbc:postgresql://</dbc:dbUrl>
		<dbc:dbType>PostgreSQL</dbc:dbType>
		<dbc:dbVersion>9.1</dbc:dbVersion>
		<dbc:driverName>JDBC</dbc:driverName>
		<dbc:dbName>test</dbc:dbName>
		<dbc:hostName>192.168.1.70</dbc:hostName>
		<dbc:listenerPortNumber>5432</dbc:listenerPortNumber>
		<dbc:ipAddress>192.168.1.70</dbc:ipAddress>
		<dbc:jdbcClassName>className</dbc:jdbcClassName>
		<dbc:sqlClientAppName>psql</dbc:sqlClientAppName>
		<dbc:sqlClientAppPath>D:\postgresql-9.2.4-1-windows-x64-binaries\pgsql\bin\
		</dbc:sqlClientAppPath>
	</dbc:dbProperties>
	<dbc:dbProperties ID="5">
		<dbc:connectionName>oracle_75</dbc:connectionName>
		<dbc:dbUrl>jdbc:oracle:thin:</dbc:dbUrl>
		<dbc:dbType>Oracle</dbc:dbType>
		<dbc:dbVersion>11</dbc:dbVersion>
		<dbc:driverName>JDBC</dbc:driverName>
		<dbc:dbName>orcl</dbc:dbName>
		<dbc:hostName>192.168.1.75</dbc:hostName>
		<dbc:listenerPortNumber>1521</dbc:listenerPortNumber>
		<dbc:ipAddress>192.168.1.75</dbc:ipAddress>
		<dbc:jdbcClassName>className</dbc:jdbcClassName>
		<dbc:sqlClientAppName>sqlplus</dbc:sqlClientAppName>
		<dbc:sqlClientAppPath>D:\instantclient-basic-windows.x64-11.2.0.3.0\instantclient_11_2\
		</dbc:sqlClientAppPath>
	</dbc:dbProperties>
	<dbc:dbProperties ID="6">
		<dbc:connectionName>centos_postgres</dbc:connectionName>
		<dbc:dbUrl>jdbc:postgresql://</dbc:dbUrl>
		<dbc:dbType>PostgreSQL</dbc:dbType>
		<dbc:dbVersion>9.1</dbc:dbVersion>
		<dbc:driverName>JDBC</dbc:driverName>
		<dbc:dbName>postgres</dbc:dbName>
		<dbc:hostName>192.168.1.70</dbc:hostName>
		<dbc:listenerPortNumber>5432</dbc:listenerPortNumber>
		<dbc:ipAddress>192.168.1.70</dbc:ipAddress>
		<dbc:jdbcClassName>className</dbc:jdbcClassName>
		<dbc:sqlClientAppName>psql</dbc:sqlClientAppName>
		<dbc:sqlClientAppPath>D:\postgresql-9.2.4-1-windows-x64-binaries\pgsql\bin\</dbc:sqlClientAppPath>
	</dbc:dbProperties>
    <dbc:dbProperties ID="11">
        <dbc:connectionName>ayhandb</dbc:connectionName>
        <dbc:dbUrl>jdbc:oracle:thin:</dbc:dbUrl>
        <dbc:dbType>Oracle</dbc:dbType>
        <dbc:dbVersion>11</dbc:dbVersion>
        <dbc:driverName>JDBC</dbc:driverName>
        <dbc:dbName>orcl</dbc:dbName>
        <dbc:hostName>ayhan-laptop2</dbc:hostName>
        <dbc:listenerPortNumber>1523</dbc:listenerPortNumber>
        <dbc:ipAddress>192.168.1.210</dbc:ipAddress>
        <dbc:jdbcClassName>className</dbc:jdbcClassName>
        <dbc:sqlClientAppName>sqlplus</dbc:sqlClientAppName>
        <dbc:sqlClientAppPath>D:\likya\projeler\tlos\tlos3.0\dss_module</dbc:sqlClientAppPath>
    </dbc:dbProperties>
</dbc:dbList>