    <dbc:dbProperties ID="1" xmlns:dbc="http://www.likyateknoloji.com/XML_dbconnection_types" xmlns:com="http://www.likyateknoloji.com/XML_common_types" xmlns:xsi="http://www.w3.org/2001/XMLSchema-instance" xsi:schemaLocation="http://www.likyateknoloji.com/XML_dbconnection_types  xmldb:exist:///db/TLOSSW/xsds/tlosSWDBConnections_v_1_0.xsd">
        <dbc:connectionName>Oracle Connection</dbc:connectionName>
        <dbc:dbUrl>jdbc:oracle:thin:</dbc:dbUrl>
        <dbc:dbType>Oracle</dbc:dbType>
        <dbc:dbVersion>11</dbc:dbVersion>
        <dbc:driverName>JDBC</dbc:driverName>
        <dbc:dbName>orcl</dbc:dbName>
        <dbc:hostName>192.168.1.75</dbc:hostName>
        <dbc:listenerPortNumber>1521</dbc:listenerPortNumber>
        <com:ipAddress>192.168.1.75</com:ipAddress>
        <dbc:jdbcClassName>className</dbc:jdbcClassName>
 		<dbc:sqlClientAppName>sqlplus</dbc:sqlClientAppName>
		<dbc:sqlClientAppPath>C:\app\ayhan\product\11.2.0\dbhome_2\BIN\</dbc:sqlClientAppPath>
    </dbc:dbProperties>