<dbc:dbList xmlns:dbc="http://www.likyateknoloji.com/XML_dbconnection_types" xmlns:com="http://www.likyateknoloji.com/XML_common_types" xmlns:xsi="http://www.w3.org/2001/XMLSchema-instance" xsi:schemaLocation="http://www.likyateknoloji.com/XML_dbconnection_types  xmldb:exist:///db/TLOSSW/xsds/tlosSWDBConnections_v_1_0.xsd">
    <dbc:dbProperties ID="1">
        <dbc:connectionName>PostgreSQL Connection</dbc:connectionName>
        <dbc:dbUrl>jdbc:postgresql://</dbc:dbUrl>
        <dbc:dbType>PostgreSQL</dbc:dbType>
        <dbc:dbVersion>9.1</dbc:dbVersion>
        <dbc:driverName>JDBC</dbc:driverName>
        <dbc:dbName>Carre</dbc:dbName>
        <dbc:hostName>ayhan-laptop2</dbc:hostName>
        <dbc:listenerPortNumber>5432</dbc:listenerPortNumber>
        <com:ipAddress>127.0.0.1</com:ipAddress>
        <dbc:jdbcClassName>className</dbc:jdbcClassName>
		<dbc:sqlClientAppName>psql</dbc:sqlClientAppName>
		<dbc:sqlClientAppPath>C:/Program Files/PostgreSQL/9.1/bin/</dbc:sqlClientAppPath>
    </dbc:dbProperties>
    <dbc:dbProperties ID="2">
        <dbc:connectionName>Oracle Connection</dbc:connectionName>
        <dbc:dbUrl>jdbc:oracle:thin:</dbc:dbUrl>
        <dbc:dbType>Oracle</dbc:dbType>
        <dbc:dbVersion>11</dbc:dbVersion>
        <dbc:driverName>JDBC</dbc:driverName>
        <dbc:dbName>oralikya</dbc:dbName>
        <dbc:hostName>localhost</dbc:hostName>
        <dbc:listenerPortNumber>1521</dbc:listenerPortNumber>
        <com:ipAddress>127.0.0.1</com:ipAddress>
        <dbc:jdbcClassName>className</dbc:jdbcClassName>
 		<dbc:sqlClientAppName>sqlplus</dbc:sqlClientAppName>
		<dbc:sqlClientAppPath>C:\app\ayhan\product\11.2.0\dbhome_2\BIN\</dbc:sqlClientAppPath>        
    </dbc:dbProperties>
</dbc:dbList>